{
  "schema_version": "0.10",
  "generated_at": "2026-08-17T21:38:10.477477+00:00",
  "status": "APPROVED",
  "model_call_contract": {
    "normal_generation_calls": 2,
    "repair_call_limit_per_slide": 1,
    "ai_authored_documents": [
      "deck_plan.json",
      "slide_plans.json"
    ]
  },
  "slides": [
    {
      "slide_id": "OUT-S001",
      "message": "レシートキャンペーンを、公開準備から抽選までひとつに",
      "semantic_chunks": [
        "レシートキャンペーンを、",
        "公開準備から抽選までひとつに"
      ],
      "semantic_relation": "statement",
      "visual": {
        "type": "conceptual_image",
        "purpose": "statement"
      },
      "source": {
        "slide_id": "SRC-S001",
        "mode": "RECOMPOSE"
      },
      "layout": {
        "family": "full_bleed",
        "density": "medium_low",
        "fill_policy": "full_bleed",
        "request": {
          "family": "full_bleed",
          "density": "medium_low",
          "title": "レシートキャンペーンを、\n公開準備から抽選までひとつに",
          "body": "Aha! レシート Lite\n必要十分な機能を、導入しやすい価格で。",
          "title_font_pt": 66,
          "body_font_pt": 22,
          "image_recipe_id": "IMG-OUT-S001-01",
          "bleed_to_slide": true,
          "reuse_source_image_frame": false,
          "overlay_position": "left",
          "overlay_panel": "solid",
          "overlay_color": "FFFFFF",
          "overlay_opacity": 0.91,
          "overlay_width_ratio": 0.6,
          "overlay_height_ratio": 0.62,
          "clear_region_object_ids": [
            "SRC-S001-O002",
            "SRC-S001-O003",
            "SRC-S001-O004",
            "SRC-S001-O005",
            "SRC-S001-O006",
            "SRC-S001-O007",
            "SRC-S001-O008",
            "SRC-S001-O009",
            "SRC-S001-O010",
            "SRC-S001-O011",
            "SRC-S001-O012",
            "SRC-S001-O013",
            "SRC-S001-O014"
          ],
          "style_source_object_ids": {
            "title": "SRC-S001-O004",
            "item_body": "SRC-S001-O010"
          }
        }
      },
      "content": {},
      "image": {
        "recipe_id": "IMG-OUT-S001-01",
        "reuse_source_frame": false
      },
      "runtime": {
        "content_blocks": [
          {
            "id": "CB-OUT-S001-TITLE",
            "role": "title",
            "source_text": "レシートキャンペーンを、公開準備から抽選までひとつに",
            "semantic_text": "レシートキャンペーンを、公開準備から抽選までひとつに",
            "render_text": "レシートキャンペーンを、\n公開準備から抽選までひとつに"
          }
        ],
        "source_object_mutations": [],
        "composer_support": "layout_engine"
      },
      "status": "APPROVED",
      "origin": "human_calibrated_golden_sample"
    },
    {
      "slide_id": "OUT-S002",
      "message": "必要な機能を標準化するから、導入しやすい",
      "semantic_chunks": [
        "必要な機能を標準化するから、",
        "導入しやすい"
      ],
      "semantic_relation": "evidence",
      "visual": {
        "type": "screenshot",
        "purpose": "evidence"
      },
      "source": {
        "slide_id": "SRC-S004",
        "mode": "RECOMPOSE"
      },
      "layout": {
        "family": "photo_text",
        "density": "medium_low",
        "fill_policy": "balanced",
        "request": {
          "family": "photo_text",
          "density": "medium_low",
          "title": "必要な機能を標準化するから、\n導入しやすい",
          "subtitle": "キャンペーン運用に必要な機能を、使いやすい形で標準搭載。",
          "body": "過剰な個別開発を抑え、\n導入コストと開始までの時間を減らします。",
          "title_font_pt": 48,
          "subtitle_font_pt": 21,
          "body_font_pt": 21,
          "image_recipe_id": "IMG-OUT-S002-01",
          "image_source_object_id": "SRC-S004-O004",
          "image_position": "right",
          "text_side": "left",
          "image_ratio": 0.5,
          "reuse_source_image_frame": true,
          "clear_region_object_ids": [
            "SRC-S004-O002",
            "SRC-S004-O003",
            "SRC-S004-O004",
            "SRC-S004-O005",
            "SRC-S004-O006",
            "SRC-S004-O007",
            "SRC-S004-O008",
            "SRC-S004-O009",
            "SRC-S004-O010",
            "SRC-S004-O011",
            "SRC-S004-O012"
          ],
          "style_source_object_ids": {
            "title": "SRC-S004-O006",
            "subtitle": "SRC-S004-O007",
            "item_body": "SRC-S004-O011",
            "image": "SRC-S004-O004"
          }
        }
      },
      "content": {},
      "image": {
        "recipe_id": "IMG-OUT-S002-01",
        "position": "right",
        "text_side": "left",
        "ratio": 0.5,
        "source_object_id": "SRC-S004-O004",
        "reuse_source_frame": true
      },
      "runtime": {
        "content_blocks": [
          {
            "id": "CB-OUT-S002-TITLE",
            "role": "title",
            "source_text": "必要な機能を標準化するから、導入しやすい",
            "semantic_text": "必要な機能を標準化するから、導入しやすい",
            "render_text": "必要な機能を標準化するから、\n導入しやすい"
          }
        ],
        "source_object_mutations": [],
        "composer_support": "layout_engine"
      },
      "status": "APPROVED",
      "origin": "human_calibrated_golden_sample"
    },
    {
      "slide_id": "OUT-S003",
      "message": "Googleフォーム・Lite・フル版の違い",
      "semantic_chunks": [],
      "semantic_relation": "comparison",
      "visual": {
        "type": "table",
        "purpose": "comparison"
      },
      "source": {
        "slide_id": "SRC-S011",
        "mode": "RECOMPOSE"
      },
      "layout": {
        "family": "comparison_matrix",
        "density": "medium_low",
        "fill_policy": "content_filled",
        "request": {
          "family": "comparison_matrix",
          "density": "medium_low",
          "title": "Googleフォーム・Lite・フル版の違い",
          "subtitle": "○：標準対応　△：別作業が必要　×：標準では非対応",
          "title_font_pt": 42,
          "subtitle_font_pt": 18,
          "matrix": {
            "row_labels": [
              "フォーム項目",
              "レシート応募",
              "デザイン変更",
              "応募検索",
              "データ出力",
              "抽選",
              "OCR"
            ],
            "columns": [
              {
                "title": "Googleフォーム",
                "values": [
                  "○",
                  "△",
                  "×",
                  "△",
                  "○",
                  "△",
                  "×"
                ]
              },
              {
                "title": "Lite",
                "values": [
                  "○",
                  "○",
                  "○",
                  "○",
                  "○",
                  "○",
                  "×"
                ]
              },
              {
                "title": "フル版",
                "values": [
                  "○",
                  "○",
                  "○",
                  "○",
                  "○",
                  "○",
                  "○"
                ]
              }
            ],
            "highlight_column": 1
          },
          "clear_region_object_ids": [
            "SRC-S011-O002",
            "SRC-S011-O003",
            "SRC-S011-O004",
            "SRC-S011-O005",
            "SRC-S011-O006",
            "SRC-S011-O007",
            "SRC-S011-O008",
            "SRC-S011-O009",
            "SRC-S011-O010",
            "SRC-S011-O011",
            "SRC-S011-O012",
            "SRC-S011-O013",
            "SRC-S011-O014"
          ],
          "style_source_object_ids": {
            "title": "SRC-S011-O005",
            "subtitle": "SRC-S011-O006",
            "item_title": "SRC-S011-O012",
            "item_body": "SRC-S011-O011",
            "table": "SRC-S011-O010"
          }
        }
      },
      "content": {},
      "image": {},
      "runtime": {
        "content_blocks": [
          {
            "id": "CB-OUT-S003-TITLE",
            "role": "title",
            "source_text": "Googleフォーム・Lite・フル版の違い",
            "semantic_text": "Googleフォーム・Lite・フル版の違い",
            "render_text": "Googleフォーム・Lite・フル版の違い"
          }
        ],
        "source_object_mutations": [],
        "composer_support": "layout_engine"
      },
      "status": "APPROVED",
      "origin": "human_calibrated_golden_sample"
    },
    {
      "slide_id": "OUT-S004",
      "message": "20年間の知見を、導入しやすい標準機能へ",
      "semantic_chunks": [],
      "semantic_relation": "cause_effect",
      "visual": {
        "type": "flow",
        "purpose": "cause_effect"
      },
      "source": {
        "slide_id": "SRC-S014",
        "mode": "RECOMPOSE"
      },
      "layout": {
        "family": "process",
        "density": "medium_low",
        "fill_policy": "content_filled",
        "request": {
          "family": "process",
          "density": "medium_low",
          "title": "20年間の知見を、導入しやすい標準機能へ",
          "subtitle": "毎回ゼロから開発せず、よく使う運用をLiteに集約します。",
          "title_font_pt": 42,
          "subtitle_font_pt": 19,
          "items": [
            {
              "number": "01",
              "title": "20年の知見",
              "body": "実例を蓄積"
            },
            {
              "number": "02",
              "title": "機能を抽出",
              "body": "要件を整理"
            },
            {
              "number": "03",
              "title": "Liteに標準化",
              "body": "標準機能に集約"
            },
            {
              "number": "04",
              "title": "導入しやすく",
              "body": "価格と時間を抑える"
            }
          ],
          "clear_region_object_ids": [
            "SRC-S014-O002",
            "SRC-S014-O003",
            "SRC-S014-O004",
            "SRC-S014-O005",
            "SRC-S014-O006",
            "SRC-S014-O007",
            "SRC-S014-O008",
            "SRC-S014-O009",
            "SRC-S014-O010",
            "SRC-S014-O011",
            "SRC-S014-O012",
            "SRC-S014-O013",
            "SRC-S014-O014",
            "SRC-S014-O015",
            "SRC-S014-O016",
            "SRC-S014-O017",
            "SRC-S014-O018",
            "SRC-S014-O019",
            "SRC-S014-O020",
            "SRC-S014-O021",
            "SRC-S014-O022",
            "SRC-S014-O023",